[
 {
  "source_node_id": "SA.code",
  "target_node_id": "SA.root",
  "edge_type": "subtype_of",
  "confidence": 1.0,
  "provenance": "derived:hierarchy",
  "version": "SummarizerAgent.9ea09b9as.v14"
 },
 {
  "source_node_id": "SA.code.feedback_suffix",
  "target_node_id": "SA.code",
  "edge_type": "subtype_of",
  "confidence": 1.0,
  "provenance": "derived:hierarchy",
  "version": "SummarizerAgent.9ea09b9as.v14"
 },
 {
  "source_node_id": "SA.directives",
  "target_node_id": "SA.root",
  "edge_type": "subtype_of",
  "confidence": 1.0,
  "provenance": "derived:hierarchy",
  "version": "SummarizerAgent.9ea09b9as.v14"
 },
 {
  "source_node_id": "SA.directives.evidence_card_discipline",
  "target_node_id": "SA.directives",
  "edge_type": "subtype_of",
  "confidence": 1.0,
  "provenance": "derived:hierarchy",
  "version": "SummarizerAgent.9ea09b9as.v14"
 },
 {
  "source_node_id": "SA.directives.ground_truth",
  "target_node_id": "SA.directives",
  "edge_type": "subtype_of",
  "confidence": 1.0,
  "provenance": "derived:hierarchy",
  "version": "SummarizerAgent.9ea09b9as.v14"
 },
 {
  "source_node_id": "SA.directives.position_lot_accounting",
  "target_node_id": "SA.directives",
  "edge_type": "subtype_of",
  "confidence": 1.0,
  "provenance": "derived:hierarchy",
  "version": "SummarizerAgent.9ea09b9as.v14"
 },
 {
  "source_node_id": "SA.memory",
  "target_node_id": "SA.root",
  "edge_type": "subtype_of",
  "confidence": 1.0,
  "provenance": "derived:hierarchy",
  "version": "SummarizerAgent.9ea09b9as.v14"
 },
 {
  "source_node_id": "SA.memory.extraction_patterns",
  "target_node_id": "SA.memory",
  "edge_type": "subtype_of",
  "confidence": 1.0,
  "provenance": "derived:hierarchy",
  "version": "SummarizerAgent.9ea09b9as.v14"
 },
 {
  "source_node_id": "SA.memory.log",
  "target_node_id": "SA.memory",
  "edge_type": "subtype_of",
  "confidence": 1.0,
  "provenance": "derived:hierarchy",
  "version": "SummarizerAgent.9ea09b9as.v14"
 },
 {
  "source_node_id": "SA.memory.log.2026_08_20",
  "target_node_id": "SA.memory.log",
  "edge_type": "subtype_of",
  "confidence": 1.0,
  "provenance": "derived:hierarchy",
  "version": "SummarizerAgent.9ea09b9as.v14"
 },
 {
  "source_node_id": "SA.memory.log.2026_08_21_portfolio_state",
  "target_node_id": "SA.ticker.crm",
  "edge_type": "cites",
  "confidence": 1.0,
  "provenance": "derived:ticker",
  "version": "SummarizerAgent.9ea09b9as.v14",
  "via": "[[CRM]]"
 },
 {
  "source_node_id": "SA.memory.log.2026_08_21_portfolio_state",
  "target_node_id": "SA.ticker.gm",
  "edge_type": "cites",
  "confidence": 1.0,
  "provenance": "derived:ticker",
  "version": "SummarizerAgent.9ea09b9as.v14",
  "via": "[[GM]]"
 },
 {
  "source_node_id": "SA.memory.log.2026_08_21_portfolio_state",
  "target_node_id": "SA.memory.log",
  "edge_type": "subtype_of",
  "confidence": 1.0,
  "provenance": "derived:hierarchy",
  "version": "SummarizerAgent.9ea09b9as.v14"
 },
 {
  "source_node_id": "SA.memory.log.2026_08_21_technical_pullback",
  "target_node_id": "SA.ticker.crm",
  "edge_type": "cites",
  "confidence": 1.0,
  "provenance": "derived:ticker",
  "version": "SummarizerAgent.9ea09b9as.v14",
  "via": "[[CRM]]"
 },
 {
  "source_node_id": "SA.memory.log.2026_08_21_technical_pullback",
  "target_node_id": "SA.ticker.ionq",
  "edge_type": "cites",
  "confidence": 1.0,
  "provenance": "derived:ticker",
  "version": "SummarizerAgent.9ea09b9as.v14",
  "via": "[[IONQ]]"
 },
 {
  "source_node_id": "SA.memory.log.2026_08_21_technical_pullback",
  "target_node_id": "SA.ticker.orcl",
  "edge_type": "cites",
  "confidence": 1.0,
  "provenance": "derived:ticker",
  "version": "SummarizerAgent.9ea09b9as.v14",
  "via": "[[ORCL]]"
 },
 {
  "source_node_id": "SA.memory.log.2026_08_21_technical_pullback",
  "target_node_id": "SA.ticker.rklb",
  "edge_type": "cites",
  "confidence": 1.0,
  "provenance": "derived:ticker",
  "version": "SummarizerAgent.9ea09b9as.v14",
  "via": "[[RKLB]]"
 },
 {
  "source_node_id": "SA.memory.log.2026_08_21_technical_pullback",
  "target_node_id": "SA.ticker.smci",
  "edge_type": "cites",
  "confidence": 1.0,
  "provenance": "derived:ticker",
  "version": "SummarizerAgent.9ea09b9as.v14",
  "via": "[[SMCI]]"
 },
 {
  "source_node_id": "SA.memory.log.2026_08_21_technical_pullback",
  "target_node_id": "SA.ticker.team",
  "edge_type": "cites",
  "confidence": 1.0,
  "provenance": "derived:ticker",
  "version": "SummarizerAgent.9ea09b9as.v14",
  "via": "[[TEAM]]"
 },
 {
  "source_node_id": "SA.memory.log.2026_08_21_technical_pullback",
  "target_node_id": "SA.memory.log",
  "edge_type": "subtype_of",
  "confidence": 1.0,
  "provenance": "derived:hierarchy",
  "version": "SummarizerAgent.9ea09b9as.v14"
 },
 {
  "source_node_id": "SA.memory.media_manipulation",
  "target_node_id": "SA.memory",
  "edge_type": "subtype_of",
  "confidence": 1.0,
  "provenance": "derived:hierarchy",
  "version": "SummarizerAgent.9ea09b9as.v14"
 },
 {
  "source_node_id": "SA.memory.source_quality",
  "target_node_id": "SA.memory",
  "edge_type": "subtype_of",
  "confidence": 1.0,
  "provenance": "derived:hierarchy",
  "version": "SummarizerAgent.9ea09b9as.v14"
 },
 {
  "source_node_id": "SA.runtime.inputs",
  "target_node_id": "SA.root",
  "edge_type": "subtype_of",
  "confidence": 1.0,
  "provenance": "derived:hierarchy",
  "version": "SummarizerAgent.9ea09b9as.v14"
 },
 {
  "source_node_id": "SA.soul",
  "target_node_id": "SA.root",
  "edge_type": "subtype_of",
  "confidence": 1.0,
  "provenance": "derived:hierarchy",
  "version": "SummarizerAgent.9ea09b9as.v14"
 },
 {
  "source_node_id": "SA.soul.core_philosophy",
  "target_node_id": "SA.soul",
  "edge_type": "subtype_of",
  "confidence": 1.0,
  "provenance": "derived:hierarchy",
  "version": "SummarizerAgent.9ea09b9as.v14"
 },
 {
  "source_node_id": "SA.soul.extraction_style",
  "target_node_id": "SA.soul",
  "edge_type": "subtype_of",
  "confidence": 1.0,
  "provenance": "derived:hierarchy",
  "version": "SummarizerAgent.9ea09b9as.v14"
 },
 {
  "source_node_id": "SA.soul.identity",
  "target_node_id": "SA.soul",
  "edge_type": "subtype_of",
  "confidence": 1.0,
  "provenance": "derived:hierarchy",
  "version": "SummarizerAgent.9ea09b9as.v14"
 },
 {
  "source_node_id": "SA.soul.mission",
  "target_node_id": "SA.soul",
  "edge_type": "subtype_of",
  "confidence": 1.0,
  "provenance": "derived:hierarchy",
  "version": "SummarizerAgent.9ea09b9as.v14"
 },
 {
  "source_node_id": "SA.soul.principles",
  "target_node_id": "SA.soul",
  "edge_type": "subtype_of",
  "confidence": 1.0,
  "provenance": "derived:hierarchy",
  "version": "SummarizerAgent.9ea09b9as.v14"
 },
 {
  "source_node_id": "SA.template.system",
  "target_node_id": "SA.directives",
  "edge_type": "includes",
  "confidence": 1.0,
  "provenance": "derived:assembly",
  "version": "SummarizerAgent.9ea09b9as.v14",
  "via": "{strategy_directives}"
 },
 {
  "source_node_id": "SA.template.system",
  "target_node_id": "SA.memory",
  "edge_type": "includes",
  "confidence": 1.0,
  "provenance": "derived:assembly",
  "version": "SummarizerAgent.9ea09b9as.v14",
  "via": "## LESSONS FROM EXPERIENCE"
 },
 {
  "source_node_id": "SA.template.system",
  "target_node_id": "SA.soul",
  "edge_type": "includes",
  "confidence": 1.0,
  "provenance": "derived:assembly",
  "version": "SummarizerAgent.9ea09b9as.v14",
  "via": "## AGENT IDENTITY"
 },
 {
  "source_node_id": "SA.template.system",
  "target_node_id": "SA.root",
  "edge_type": "subtype_of",
  "confidence": 1.0,
  "provenance": "derived:hierarchy",
  "version": "SummarizerAgent.9ea09b9as.v14"
 },
 {
  "source_node_id": "SA.template.user",
  "target_node_id": "SA.code.feedback_suffix",
  "edge_type": "includes",
  "confidence": 1.0,
  "provenance": "derived:assembly",
  "version": "SummarizerAgent.9ea09b9as.v14",
  "via": "system_tail"
 },
 {
  "source_node_id": "SA.template.user",
  "target_node_id": "SA.runtime.inputs",
  "edge_type": "includes",
  "confidence": 1.0,
  "provenance": "derived:assembly",
  "version": "SummarizerAgent.9ea09b9as.v14",
  "via": "per-cycle"
 },
 {
  "source_node_id": "SA.template.user",
  "target_node_id": "SA.root",
  "edge_type": "subtype_of",
  "confidence": 1.0,
  "provenance": "derived:hierarchy",
  "version": "SummarizerAgent.9ea09b9as.v14"
 },
 {
  "source_node_id": "SA.ticker.crm",
  "target_node_id": "SA.root",
  "edge_type": "subtype_of",
  "confidence": 1.0,
  "provenance": "derived:hierarchy",
  "version": "SummarizerAgent.9ea09b9as.v14"
 },
 {
  "source_node_id": "SA.ticker.gm",
  "target_node_id": "SA.root",
  "edge_type": "subtype_of",
  "confidence": 1.0,
  "provenance": "derived:hierarchy",
  "version": "SummarizerAgent.9ea09b9as.v14"
 },
 {
  "source_node_id": "SA.ticker.ionq",
  "target_node_id": "SA.root",
  "edge_type": "subtype_of",
  "confidence": 1.0,
  "provenance": "derived:hierarchy",
  "version": "SummarizerAgent.9ea09b9as.v14"
 },
 {
  "source_node_id": "SA.ticker.orcl",
  "target_node_id": "SA.root",
  "edge_type": "subtype_of",
  "confidence": 1.0,
  "provenance": "derived:hierarchy",
  "version": "SummarizerAgent.9ea09b9as.v14"
 },
 {
  "source_node_id": "SA.ticker.rklb",
  "target_node_id": "SA.root",
  "edge_type": "subtype_of",
  "confidence": 1.0,
  "provenance": "derived:hierarchy",
  "version": "SummarizerAgent.9ea09b9as.v14"
 },
 {
  "source_node_id": "SA.ticker.smci",
  "target_node_id": "SA.root",
  "edge_type": "subtype_of",
  "confidence": 1.0,
  "provenance": "derived:hierarchy",
  "version": "SummarizerAgent.9ea09b9as.v14"
 },
 {
  "source_node_id": "SA.ticker.team",
  "target_node_id": "SA.root",
  "edge_type": "subtype_of",
  "confidence": 1.0,
  "provenance": "derived:hierarchy",
  "version": "SummarizerAgent.9ea09b9as.v14"
 }
]
