[
 {
  "source_node_id": "FA.code",
  "target_node_id": "FA.root",
  "edge_type": "subtype_of",
  "confidence": 1.0,
  "provenance": "derived:hierarchy",
  "version": "FeedbackAgent.baseline.v0"
 },
 {
  "source_node_id": "FA.code.base_instructions",
  "target_node_id": "FA.code",
  "edge_type": "subtype_of",
  "confidence": 1.0,
  "provenance": "derived:hierarchy",
  "version": "FeedbackAgent.baseline.v0"
 },
 {
  "source_node_id": "FA.code.json_format",
  "target_node_id": "FA.code",
  "edge_type": "subtype_of",
  "confidence": 1.0,
  "provenance": "derived:hierarchy",
  "version": "FeedbackAgent.baseline.v0"
 },
 {
  "source_node_id": "FA.code.opportunity_charter",
  "target_node_id": "FA.code",
  "edge_type": "subtype_of",
  "confidence": 1.0,
  "provenance": "derived:hierarchy",
  "version": "FeedbackAgent.baseline.v0"
 },
 {
  "source_node_id": "FA.code.system_base",
  "target_node_id": "FA.code",
  "edge_type": "subtype_of",
  "confidence": 1.0,
  "provenance": "derived:hierarchy",
  "version": "FeedbackAgent.baseline.v0"
 },
 {
  "source_node_id": "FA.directives",
  "target_node_id": "FA.root",
  "edge_type": "subtype_of",
  "confidence": 1.0,
  "provenance": "derived:hierarchy",
  "version": "FeedbackAgent.baseline.v0"
 },
 {
  "source_node_id": "FA.memory",
  "target_node_id": "FA.root",
  "edge_type": "subtype_of",
  "confidence": 1.0,
  "provenance": "derived:hierarchy",
  "version": "FeedbackAgent.baseline.v0"
 },
 {
  "source_node_id": "FA.runtime.inputs",
  "target_node_id": "FA.root",
  "edge_type": "subtype_of",
  "confidence": 1.0,
  "provenance": "derived:hierarchy",
  "version": "FeedbackAgent.baseline.v0"
 },
 {
  "source_node_id": "FA.soul",
  "target_node_id": "FA.root",
  "edge_type": "subtype_of",
  "confidence": 1.0,
  "provenance": "derived:hierarchy",
  "version": "FeedbackAgent.baseline.v0"
 },
 {
  "source_node_id": "FA.soul.core_philosophy",
  "target_node_id": "FA.soul",
  "edge_type": "subtype_of",
  "confidence": 1.0,
  "provenance": "derived:hierarchy",
  "version": "FeedbackAgent.baseline.v0"
 },
 {
  "source_node_id": "FA.soul.identity",
  "target_node_id": "FA.soul",
  "edge_type": "subtype_of",
  "confidence": 1.0,
  "provenance": "derived:hierarchy",
  "version": "FeedbackAgent.baseline.v0"
 },
 {
  "source_node_id": "FA.soul.mission",
  "target_node_id": "FA.soul",
  "edge_type": "subtype_of",
  "confidence": 1.0,
  "provenance": "derived:hierarchy",
  "version": "FeedbackAgent.baseline.v0"
 },
 {
  "source_node_id": "FA.soul.principles",
  "target_node_id": "FA.soul",
  "edge_type": "subtype_of",
  "confidence": 1.0,
  "provenance": "derived:hierarchy",
  "version": "FeedbackAgent.baseline.v0"
 },
 {
  "source_node_id": "FA.soul.review_style",
  "target_node_id": "FA.soul",
  "edge_type": "subtype_of",
  "confidence": 1.0,
  "provenance": "derived:hierarchy",
  "version": "FeedbackAgent.baseline.v0"
 },
 {
  "source_node_id": "FA.soul.rule_style",
  "target_node_id": "FA.soul",
  "edge_type": "subtype_of",
  "confidence": 1.0,
  "provenance": "derived:hierarchy",
  "version": "FeedbackAgent.baseline.v0"
 },
 {
  "source_node_id": "FA.template.system",
  "target_node_id": "FA.directives",
  "edge_type": "includes",
  "confidence": 1.0,
  "provenance": "derived:assembly",
  "version": "FeedbackAgent.baseline.v0",
  "via": "{strategy_directives}"
 },
 {
  "source_node_id": "FA.template.system",
  "target_node_id": "FA.soul",
  "edge_type": "includes",
  "confidence": 1.0,
  "provenance": "derived:assembly",
  "version": "FeedbackAgent.baseline.v0",
  "via": "## AGENT IDENTITY"
 },
 {
  "source_node_id": "FA.template.system",
  "target_node_id": "FA.root",
  "edge_type": "subtype_of",
  "confidence": 1.0,
  "provenance": "derived:hierarchy",
  "version": "FeedbackAgent.baseline.v0"
 },
 {
  "source_node_id": "FA.template.user",
  "target_node_id": "FA.code.base_instructions",
  "edge_type": "includes",
  "confidence": 1.0,
  "provenance": "derived:assembly",
  "version": "FeedbackAgent.baseline.v0",
  "via": "user_prompt_head"
 },
 {
  "source_node_id": "FA.template.user",
  "target_node_id": "FA.code.json_format",
  "edge_type": "includes",
  "confidence": 1.0,
  "provenance": "derived:assembly",
  "version": "FeedbackAgent.baseline.v0",
  "via": "user_prompt_tail"
 },
 {
  "source_node_id": "FA.template.user",
  "target_node_id": "FA.code.opportunity_charter",
  "edge_type": "includes",
  "confidence": 1.0,
  "provenance": "derived:assembly",
  "version": "FeedbackAgent.baseline.v0",
  "via": "system_tail"
 },
 {
  "source_node_id": "FA.template.user",
  "target_node_id": "FA.code.system_base",
  "edge_type": "includes",
  "confidence": 1.0,
  "provenance": "derived:assembly",
  "version": "FeedbackAgent.baseline.v0",
  "via": "system_base"
 },
 {
  "source_node_id": "FA.template.user",
  "target_node_id": "FA.runtime.inputs",
  "edge_type": "includes",
  "confidence": 1.0,
  "provenance": "derived:assembly",
  "version": "FeedbackAgent.baseline.v0",
  "via": "per-cycle"
 },
 {
  "source_node_id": "FA.template.user",
  "target_node_id": "FA.root",
  "edge_type": "subtype_of",
  "confidence": 1.0,
  "provenance": "derived:hierarchy",
  "version": "FeedbackAgent.baseline.v0"
 }
]
