[
 {
  "source_node_id": "FA.code",
  "target_node_id": "FA.root",
  "edge_type": "subtype_of",
  "confidence": 1.0,
  "provenance": "derived:hierarchy",
  "version": "FeedbackAgent.9ea09b9as.v2"
 },
 {
  "source_node_id": "FA.code.base_instructions",
  "target_node_id": "FA.code",
  "edge_type": "subtype_of",
  "confidence": 1.0,
  "provenance": "derived:hierarchy",
  "version": "FeedbackAgent.9ea09b9as.v2"
 },
 {
  "source_node_id": "FA.code.json_format",
  "target_node_id": "FA.code",
  "edge_type": "subtype_of",
  "confidence": 1.0,
  "provenance": "derived:hierarchy",
  "version": "FeedbackAgent.9ea09b9as.v2"
 },
 {
  "source_node_id": "FA.code.system_base",
  "target_node_id": "FA.code",
  "edge_type": "subtype_of",
  "confidence": 1.0,
  "provenance": "derived:hierarchy",
  "version": "FeedbackAgent.9ea09b9as.v2"
 },
 {
  "source_node_id": "FA.directives",
  "target_node_id": "FA.root",
  "edge_type": "subtype_of",
  "confidence": 1.0,
  "provenance": "derived:hierarchy",
  "version": "FeedbackAgent.9ea09b9as.v2"
 },
 {
  "source_node_id": "FA.directives.anti_hallucination",
  "target_node_id": "FA.directives",
  "edge_type": "subtype_of",
  "confidence": 1.0,
  "provenance": "derived:hierarchy",
  "version": "FeedbackAgent.9ea09b9as.v2"
 },
 {
  "source_node_id": "FA.directives.current_process_biases_audit",
  "target_node_id": "FA.directives",
  "edge_type": "subtype_of",
  "confidence": 1.0,
  "provenance": "derived:hierarchy",
  "version": "FeedbackAgent.9ea09b9as.v2"
 },
 {
  "source_node_id": "FA.directives.current_process_biases_audit.n1",
  "target_node_id": "FA.directives.current_process_biases_audit",
  "edge_type": "subtype_of",
  "confidence": 1.0,
  "provenance": "derived:hierarchy",
  "version": "FeedbackAgent.9ea09b9as.v2"
 },
 {
  "source_node_id": "FA.directives.current_process_biases_audit.n2",
  "target_node_id": "FA.directives.current_process_biases_audit",
  "edge_type": "subtype_of",
  "confidence": 1.0,
  "provenance": "derived:hierarchy",
  "version": "FeedbackAgent.9ea09b9as.v2"
 },
 {
  "source_node_id": "FA.directives.current_process_biases_audit.n3",
  "target_node_id": "FA.directives.current_process_biases_audit",
  "edge_type": "subtype_of",
  "confidence": 1.0,
  "provenance": "derived:hierarchy",
  "version": "FeedbackAgent.9ea09b9as.v2"
 },
 {
  "source_node_id": "FA.directives.current_process_biases_audit.n4",
  "target_node_id": "FA.directives.current_process_biases_audit",
  "edge_type": "subtype_of",
  "confidence": 1.0,
  "provenance": "derived:hierarchy",
  "version": "FeedbackAgent.9ea09b9as.v2"
 },
 {
  "source_node_id": "FA.directives.current_process_biases_audit.n5",
  "target_node_id": "FA.directives.current_process_biases_audit",
  "edge_type": "subtype_of",
  "confidence": 1.0,
  "provenance": "derived:hierarchy",
  "version": "FeedbackAgent.9ea09b9as.v2"
 },
 {
  "source_node_id": "FA.directives.current_process_biases_audit.n6",
  "target_node_id": "FA.directives.current_process_biases_audit",
  "edge_type": "subtype_of",
  "confidence": 1.0,
  "provenance": "derived:hierarchy",
  "version": "FeedbackAgent.9ea09b9as.v2"
 },
 {
  "source_node_id": "FA.directives.current_process_biases_audit.n7",
  "target_node_id": "FA.directives.current_process_biases_audit",
  "edge_type": "subtype_of",
  "confidence": 1.0,
  "provenance": "derived:hierarchy",
  "version": "FeedbackAgent.9ea09b9as.v2"
 },
 {
  "source_node_id": "FA.directives.current_process_biases_audit.n8",
  "target_node_id": "FA.directives.current_process_biases_audit",
  "edge_type": "subtype_of",
  "confidence": 1.0,
  "provenance": "derived:hierarchy",
  "version": "FeedbackAgent.9ea09b9as.v2"
 },
 {
  "source_node_id": "FA.directives.ground_truth",
  "target_node_id": "FA.directives",
  "edge_type": "subtype_of",
  "confidence": 1.0,
  "provenance": "derived:hierarchy",
  "version": "FeedbackAgent.9ea09b9as.v2"
 },
 {
  "source_node_id": "FA.memory",
  "target_node_id": "FA.root",
  "edge_type": "subtype_of",
  "confidence": 1.0,
  "provenance": "derived:hierarchy",
  "version": "FeedbackAgent.9ea09b9as.v2"
 },
 {
  "source_node_id": "FA.memory.log.2026_06_20",
  "target_node_id": "FA.memory.log.2026_06_24",
  "edge_type": "related_to",
  "confidence": 1.0,
  "provenance": "derived:wikilink",
  "version": "FeedbackAgent.9ea09b9as.v2",
  "via": "[[Catalyst freshness]]"
 },
 {
  "source_node_id": "FA.memory.log.2026_06_20",
  "target_node_id": "FA.memory",
  "edge_type": "subtype_of",
  "confidence": 1.0,
  "provenance": "derived:hierarchy",
  "version": "FeedbackAgent.9ea09b9as.v2"
 },
 {
  "source_node_id": "FA.memory.log.2026_06_24",
  "target_node_id": "FA.ticker.amd",
  "edge_type": "cites",
  "confidence": 1.0,
  "provenance": "derived:ticker",
  "version": "FeedbackAgent.9ea09b9as.v2",
  "via": "[[AMD]]"
 },
 {
  "source_node_id": "FA.memory.log.2026_06_24",
  "target_node_id": "FA.ticker.nvda",
  "edge_type": "cites",
  "confidence": 1.0,
  "provenance": "derived:ticker",
  "version": "FeedbackAgent.9ea09b9as.v2",
  "via": "[[NVDA]]"
 },
 {
  "source_node_id": "FA.memory.log.2026_06_24",
  "target_node_id": "FA.memory",
  "edge_type": "subtype_of",
  "confidence": 1.0,
  "provenance": "derived:hierarchy",
  "version": "FeedbackAgent.9ea09b9as.v2"
 },
 {
  "source_node_id": "FA.runtime.inputs",
  "target_node_id": "FA.root",
  "edge_type": "subtype_of",
  "confidence": 1.0,
  "provenance": "derived:hierarchy",
  "version": "FeedbackAgent.9ea09b9as.v2"
 },
 {
  "source_node_id": "FA.soul",
  "target_node_id": "FA.root",
  "edge_type": "subtype_of",
  "confidence": 1.0,
  "provenance": "derived:hierarchy",
  "version": "FeedbackAgent.9ea09b9as.v2"
 },
 {
  "source_node_id": "FA.soul.core_philosophy",
  "target_node_id": "FA.soul",
  "edge_type": "subtype_of",
  "confidence": 1.0,
  "provenance": "derived:hierarchy",
  "version": "FeedbackAgent.9ea09b9as.v2"
 },
 {
  "source_node_id": "FA.soul.failure_pattern",
  "target_node_id": "FA.soul",
  "edge_type": "subtype_of",
  "confidence": 1.0,
  "provenance": "derived:hierarchy",
  "version": "FeedbackAgent.9ea09b9as.v2"
 },
 {
  "source_node_id": "FA.soul.identity",
  "target_node_id": "FA.soul",
  "edge_type": "subtype_of",
  "confidence": 1.0,
  "provenance": "derived:hierarchy",
  "version": "FeedbackAgent.9ea09b9as.v2"
 },
 {
  "source_node_id": "FA.soul.mission",
  "target_node_id": "FA.soul",
  "edge_type": "subtype_of",
  "confidence": 1.0,
  "provenance": "derived:hierarchy",
  "version": "FeedbackAgent.9ea09b9as.v2"
 },
 {
  "source_node_id": "FA.soul.operating_identity",
  "target_node_id": "FA.soul",
  "edge_type": "subtype_of",
  "confidence": 1.0,
  "provenance": "derived:hierarchy",
  "version": "FeedbackAgent.9ea09b9as.v2"
 },
 {
  "source_node_id": "FA.soul.principles",
  "target_node_id": "FA.soul",
  "edge_type": "subtype_of",
  "confidence": 1.0,
  "provenance": "derived:hierarchy",
  "version": "FeedbackAgent.9ea09b9as.v2"
 },
 {
  "source_node_id": "FA.soul.review_style",
  "target_node_id": "FA.soul",
  "edge_type": "subtype_of",
  "confidence": 1.0,
  "provenance": "derived:hierarchy",
  "version": "FeedbackAgent.9ea09b9as.v2"
 },
 {
  "source_node_id": "FA.template.system",
  "target_node_id": "FA.directives",
  "edge_type": "includes",
  "confidence": 1.0,
  "provenance": "derived:assembly",
  "version": "FeedbackAgent.9ea09b9as.v2",
  "via": "{strategy_directives}"
 },
 {
  "source_node_id": "FA.template.system",
  "target_node_id": "FA.memory",
  "edge_type": "includes",
  "confidence": 1.0,
  "provenance": "derived:assembly",
  "version": "FeedbackAgent.9ea09b9as.v2",
  "via": "## LESSONS FROM EXPERIENCE"
 },
 {
  "source_node_id": "FA.template.system",
  "target_node_id": "FA.soul",
  "edge_type": "includes",
  "confidence": 1.0,
  "provenance": "derived:assembly",
  "version": "FeedbackAgent.9ea09b9as.v2",
  "via": "## AGENT IDENTITY"
 },
 {
  "source_node_id": "FA.template.system",
  "target_node_id": "FA.root",
  "edge_type": "subtype_of",
  "confidence": 1.0,
  "provenance": "derived:hierarchy",
  "version": "FeedbackAgent.9ea09b9as.v2"
 },
 {
  "source_node_id": "FA.template.user",
  "target_node_id": "FA.code.base_instructions",
  "edge_type": "includes",
  "confidence": 1.0,
  "provenance": "derived:assembly",
  "version": "FeedbackAgent.9ea09b9as.v2",
  "via": "user_prompt_head"
 },
 {
  "source_node_id": "FA.template.user",
  "target_node_id": "FA.code.json_format",
  "edge_type": "includes",
  "confidence": 1.0,
  "provenance": "derived:assembly",
  "version": "FeedbackAgent.9ea09b9as.v2",
  "via": "user_prompt_tail"
 },
 {
  "source_node_id": "FA.template.user",
  "target_node_id": "FA.code.system_base",
  "edge_type": "includes",
  "confidence": 1.0,
  "provenance": "derived:assembly",
  "version": "FeedbackAgent.9ea09b9as.v2",
  "via": "system_base"
 },
 {
  "source_node_id": "FA.template.user",
  "target_node_id": "FA.runtime.inputs",
  "edge_type": "includes",
  "confidence": 1.0,
  "provenance": "derived:assembly",
  "version": "FeedbackAgent.9ea09b9as.v2",
  "via": "per-cycle"
 },
 {
  "source_node_id": "FA.template.user",
  "target_node_id": "FA.root",
  "edge_type": "subtype_of",
  "confidence": 1.0,
  "provenance": "derived:hierarchy",
  "version": "FeedbackAgent.9ea09b9as.v2"
 },
 {
  "source_node_id": "FA.ticker.amd",
  "target_node_id": "FA.root",
  "edge_type": "subtype_of",
  "confidence": 1.0,
  "provenance": "derived:hierarchy",
  "version": "FeedbackAgent.9ea09b9as.v2"
 },
 {
  "source_node_id": "FA.ticker.nvda",
  "target_node_id": "FA.root",
  "edge_type": "subtype_of",
  "confidence": 1.0,
  "provenance": "derived:hierarchy",
  "version": "FeedbackAgent.9ea09b9as.v2"
 }
]
